{
  "schemaVersion": 1,
  "id": "M05-U04",
  "moduleId": "M05",
  "number": 4,
  "title": "Ma liste d'idées",
  "status": "published",
  "estimatedMinutes": 40,
  "objectives": [
    "Comprendre pourquoi il vaut mieux avoir plusieurs idées.",
    "Rassembler six idées d'entreprise dans une seule liste.",
    "Trier tes idées avec trois questions simples.",
    "Garder les trois idées les plus solides pour toi."
  ],
  "blocks": [
    {
      "id": "introduction",
      "kind": "text",
      "title": "Tout rassembler",
      "body": "Tu as maintenant beaucoup de matière : les problèmes repérés dans l'unité « Développer sa créativité », les plaintes que tu as entendues, la chaîne de valeurs et le tour du quartier. Il est temps de tout rassembler au même endroit."
    },
    {
      "id": "metier_pas_entreprise",
      "kind": "text",
      "title": "Un métier n'est pas une entreprise",
      "body": "Ton métier, c'est ta force. Mais avec la même formation en cuir, tu peux fabriquer, réparer, revendre ou fournir les autres, et à des places très différentes de la chaîne. Ce sont autant d'entreprises possibles."
    },
    {
      "id": "pourquoi_plusieurs",
      "kind": "text",
      "title": "Pourquoi plusieurs idées ?",
      "body": "Ne t'arrête pas à la première idée qui te vient. Si tu n'en as qu'une, tu la prendras même si elle est mauvaise. C'est ce qui est arrivé à Mamadou. Avec quelques idées côte à côte, tu peux comparer et garder la meilleure."
    },
    {
      "id": "remue_meninges_consigne",
      "kind": "text",
      "title": "Un remue-méninges pour compléter",
      "body": "Tu connais la méthode depuis l'unité « Prendre des décisions » : on part d'un problème ou d'un mot, chacun dit toutes les idées qui lui viennent, et personne ne critique. On note tout, même ce qui paraît bizarre. On trie après."
    },
    {
      "id": "remue_meninges_classe",
      "kind": "text",
      "title": "En classe",
      "body": "En groupe, vous prenez le mot « cuir ». Pendant dix minutes, vous notez toutes les activités possibles qui vous viennent. Puis vous recommencez avec un autre mot lié à votre métier : « chaussure », « sac », « peau » ou « marché ». Quand les idées s'arrêtent, continuez : les meilleures viennent souvent juste après."
    },
    {
      "id": "remue_meninges",
      "kind": "exercise",
      "title": "Mes idées du remue-méninges",
      "items": [
        {
          "id": "remue_meninges_cuir",
          "kind": "textarea",
          "prompt": "Avec le mot « cuir » : écris toutes les activités possibles trouvées par ton groupe, même les plus bizarres."
        },
        {
          "id": "remue_meninges_autre_mot",
          "kind": "textarea",
          "prompt": "Avec un autre mot, comme « chaussure », « sac », « peau » ou « marché » : écris le mot choisi, puis toutes les activités trouvées."
        }
      ]
    },
    {
      "id": "liste_consigne",
      "kind": "text",
      "title": "Ma liste d'idées",
      "body": "Rassemble toutes tes idées, d'où qu'elles viennent. Vise six idées, pas besoin de plus. Essaie d'avoir au moins deux façons de faire différentes : par exemple fabriquer un article, mais aussi réparer ou fournir. Pour dire d'où vient l'idée, écris simplement : mon métier, une plainte entendue, la chaîne de valeurs, le tour du quartier ou le remue-méninges."
    },
    {
      "id": "liste_idees",
      "kind": "exercise",
      "title": "Mes six idées",
      "items": [
        {
          "id": "liste_idee_1",
          "kind": "textarea",
          "prompt": "Idée 1 : écris ton idée, d'où elle vient, et à quel besoin elle répond."
        },
        {
          "id": "liste_idee_2",
          "kind": "textarea",
          "prompt": "Idée 2 : écris ton idée, d'où elle vient, et à quel besoin elle répond."
        },
        {
          "id": "liste_idee_3",
          "kind": "textarea",
          "prompt": "Idée 3 : écris ton idée, d'où elle vient, et à quel besoin elle répond."
        },
        {
          "id": "liste_idee_4",
          "kind": "textarea",
          "prompt": "Idée 4 : écris ton idée, d'où elle vient, et à quel besoin elle répond."
        },
        {
          "id": "liste_idee_5",
          "kind": "textarea",
          "prompt": "Idée 5 : écris ton idée, d'où elle vient, et à quel besoin elle répond."
        },
        {
          "id": "liste_idee_6",
          "kind": "textarea",
          "prompt": "Idée 6 : écris ton idée, d'où elle vient, et à quel besoin elle répond."
        }
      ]
    },
    {
      "id": "premier_tri",
      "kind": "process",
      "title": "Un premier tri : trois questions pour chaque idée",
      "items": [
        {
          "title": "Est-ce que je sais faire, ou est-ce que je peux apprendre ?",
          "body": "Si l'activité demande un métier que tu ne maîtrises pas du tout, elle est risquée."
        },
        {
          "title": "Est-ce qu'il y a vraiment des clients ?",
          "body": "Pas « je crois que ça plairait », mais des gens que tu peux nommer."
        },
        {
          "title": "Est-ce que je peux commencer petit ?",
          "body": "Si l'idée demande beaucoup d'argent dès le premier jour, mets-la de côté pour plus tard."
        }
      ]
    },
    {
      "id": "pas_pour_maintenant",
      "kind": "text",
      "title": "Une idée écartée n'est pas mauvaise",
      "body": "Tu ne peux pas étudier six idées en détail. Une idée qui répond « non » à l'une des trois questions n'est pas mauvaise en soi. Elle n'est simplement pas pour toi, maintenant. Garde quand même ta liste : ces idées pourront servir plus tard."
    },
    {
      "id": "trois_idees_consigne",
      "kind": "text",
      "title": "Mes trois idées à garder",
      "body": "Passe tes six idées au crible des trois questions. Garde les trois meilleures. Pour chacune, réponds aux trois questions : je sais faire ? Il y a des clients ? Je peux commencer petit ?"
    },
    {
      "id": "trois_idees",
      "kind": "exercise",
      "title": "Les trois idées que je garde",
      "items": [
        {
          "id": "idee_gardee_1",
          "kind": "textarea",
          "prompt": "Première idée gardée : écris l'idée, puis ta réponse aux trois questions. Est-ce que je sais faire ? Est-ce qu'il y a des clients ? Est-ce que je peux commencer petit ?"
        },
        {
          "id": "idee_gardee_2",
          "kind": "textarea",
          "prompt": "Deuxième idée gardée : écris l'idée, puis ta réponse aux trois questions. Est-ce que je sais faire ? Est-ce qu'il y a des clients ? Est-ce que je peux commencer petit ?"
        },
        {
          "id": "idee_gardee_3",
          "kind": "textarea",
          "prompt": "Troisième idée gardée : écris l'idée, puis ta réponse aux trois questions. Est-ce que je sais faire ? Est-ce qu'il y a des clients ? Est-ce que je peux commencer petit ?"
        }
      ]
    },
    {
      "id": "suite_terrain",
      "kind": "text",
      "title": "Et ensuite ?",
      "body": "Ces trois idées, tu vas aller les vérifier sur le terrain dans l'unité « Choisir la bonne idée », avant de choisir pour de bon."
    },
    {
      "id": "a_retenir",
      "kind": "takeaway",
      "title": "À retenir",
      "body": "Un métier n'est pas une entreprise : la même formation ouvre plusieurs activités. Compare quelques idées au lieu de te jeter sur la première. Pendant un remue-méninges, on ne critique pas : le tri vient après. Une bonne idée pour toi, tu sais la faire, elle a des clients réels, et tu peux la démarrer petit. Garde les idées écartées pour plus tard."
    },
    {
      "id": "journal_formation",
      "kind": "exercise",
      "title": "Mon journal de formation",
      "label": "Prends quelques minutes pour garder une trace de ce que tu as appris.",
      "items": [
        {
          "id": "journal_ce_que_je_retiens",
          "kind": "textarea",
          "prompt": "Laquelle des trois questions du tri t'a le plus aidé à choisir ? Pourquoi ?"
        },
        {
          "id": "journal_reussi",
          "kind": "textarea",
          "prompt": "Qu'est-ce que tu as bien réussi ou bien compris ?"
        },
        {
          "id": "journal_difficile",
          "kind": "textarea",
          "prompt": "Qu'est-ce qui a été difficile pour toi ?"
        },
        {
          "id": "journal_mon_prochain_pas",
          "kind": "textarea",
          "prompt": "Cette semaine, à qui vas-tu parler de tes trois idées pour avoir son avis ?"
        },
        {
          "id": "journal_ressenti",
          "kind": "scale",
          "group": "Comment je me sens",
          "options": ["Pas à l'aise", "Moyen", "À l'aise", "Très à l'aise"],
          "questions": [
            {
              "id": "ressenti_unite",
              "text": "Comment te sens-tu après cette unité ?"
            }
          ]
        }
      ]
    }
  ]
}
